title,cate,lat,lng,addr,date
12個故事角色形象 打造有型品牌 基礎篇(12/19台北),Business,25.0439687,121.51517560000002,台北市館前路71號10樓,2016-12-19 11:10~2016-12-19 13:40
天地人學堂： 實體店面開設暨經營 系列課程,Education,25.0417491,121.5276814,台北市中正區齊東街74號（天地人文創）,2016-03-10 11:30~2016-03-31 13:30
【2016 Maker Faire】PCB烤箱體驗工作坊,Travel,25.0961275,121.51668740000002,台北市士林區士商路189號B1會議室B,2016-05-08 07:00~2016-05-08 09:00
Acer宏碁+Arduino 官方首次 創客PIZZA派對,Technology,25.0571504,121.61589579999998,台北市南港區經貿二路 66-1 號 樂雅樂餐廳,2016-06-03 11:00~2016-06-03 13:00
illuClass│從 0 開始學會插畫,Education,25.0413667,121.50236040000004,台北市萬華區康定路43號2樓,2016-10-05 11:30~2016-10-05 13:30
Wordpress&amp;Woocommerce Installfest 安裝趴,Technology,25.033378,121.556687,台北市大安區信義路四段341號8樓,2016-03-12 06:00~2016-03-12 09:00
illuClass｜色鉛筆與繪本想像力,Education,25.0413667,121.50236040000004,台北市萬華區康定路43號2樓,2016-03-12 02:30~2016-03-12 04:00
【2016社會企業實務論壇 轉出社企新觀點－#1 社區發展與文化保存講座】,Education,25.0431465,121.52678249999995,台北市中正區杭州南路一段 15 號 9 樓,2016-03-17 05:00~2016-03-17 09:00
2016大稻埕國際藝術節&lt;亭仔腳ㄟ佛朗明哥&gt;,Arts,25.0607452,121.51147600000002,台北市103大同區延平北路二段237號,2016-10-08 07:00~2016-10-09 08:30
女力崛起：Vanessa不安現狀的創業靈魂,Education,25.0253124,121.54410899999992,台北市大安區和平東路二段265巷3號,2016-03-24 10:30~2016-03-24 13:00
【HOME 2025，永續環境的家】現代大規模木構造建築國際研習會,Education,25.0445024,121.53725839999991,臺北市市民大道三段178號,2016-12-17 05:30~2016-12-17 10:30
為了明日的合作–––國際表演策展人研究交流計畫【與策展人有約】,Arts,25.0370403,121.51925640000002,國家兩廳院音樂廳4F交誼廳,2016-11-18 07:30~2016-11-18 11:00
超EASY新思維團隊工作術,Education,25.0457831,121.51484019999998,台北市中正區館前路8號4樓,2016-05-05 02:30~2016-07-30 08:00
從摺鳥到天文望遠鏡-無所不在的摺紙,Education,25.020665466167088,121.53813174575498,台灣大學思亮館國際會議廳,2016-10-06 10:30~2016-10-06 11:50
天地人學堂：事業開發培訓系列課程（2016年第一季）,Education,25.0417491,121.5276814,台北市中正區齊東街74號（天地人文創,2016-01-04 11:30~2016-01-25 13:30
illuClass｜手繪風電腦繪圖實作 ─ 入門篇,Education,25.0413667,121.50236040000004,台北市萬華區康定路43號2樓,2016-06-02 11:30~2016-06-02 13:00
夏季午茶約會♥,Entertainment,25.0513836,121.52917419999994,台北市中山區吉林路26巷26 號,2016-07-02 06:30~2016-07-02 09:30
【颱風延期通知】7月7日主題例會因颱風延期至9月8日舉行,Business,25.0454815,121.53112729999998,台北市中正區市民大道三段2號11F,2016-07-07 11:00~2016-07-07 13:30
2016兩岸新聞報導獎,Charity,25.0445662,121.56144670000003,台北市信義區菸廠路88號4樓之7,2016-07-01 04:00~2016-09-30 04:00
2016大稻埕國際藝術節-雙十笑慶,Entertainment,25.0610767,121.50938710000004,台北市迪化街一段265號一樓,2016-10-07 12:00~2016-10-09 09:00
善用工具輕鬆寫出有效的行銷企劃書,Education,25.0273353,121.51535749999994,青創總會(台北市和平西路一段150號12樓),2016-07-26 01:30~2016-07-26 08:30
【女人迷 x BeClothoPeople】風格時裝工作坊,Arts,25.0254388,121.5382849,台北市大安區和平東路二段50號,2016-07-16 06:00~2016-07-16 10:00
給單身者的兩性實驗室之曖昧練習題(7月),Education,25.0983031,121.53285979999998,台北市士林區忠勇街39號(合和拾間),2016-07-10 05:30~2016-07-31 10:30
TED英語討論課：中高級,Arts,25.0530499,121.54730799999992,台北市松山區南京東路三段303巷8弄11號,2016-07-30 02:30~2016-07-30 04:00
臺灣之光B型企業，揭開受國際大獎青睞的秘密,Business,25.047433,121.518104,台北車站東三門,2016-07-15 01:00~2016-07-15 09:00
【創新小學堂】帶領團隊討論與思考，從學會「問」開始！,Education,25.0397985,121.53475419999997,106台北市大安區仁愛路三段31巷16號,2016-07-06 11:00~2016-08-30 13:30
【 國際操盤職人】創造永續獲利的秘密,Education,25.0621591,121.57307930000002,台北市內湖區堤頂大道一段327號,2016-01-23 01:00~2016-01-24 09:00
【CLAPPER職人】不設限的音樂人生——王希文與四位好友的跨界火花,Arts,25.0453633,121.53098899999998,台北市中正區市民大道三段2號5樓,2016-01-07 11:30~2016-01-28 13:00
社企相扶  輪轉台灣-1217因愛一起聯合嘉年華,Arts,25.0445662,121.56144670000003,台北市信義區菸廠路88號,2016-12-17 02:00~2016-12-17 08:00
SDGs New Sexy｜派對 x 工作坊 x 提案徵件,Education,25.06958902560491,121.5205951857056,CIT 台北市玉門街1號,2016-09-30 09:00~2016-10-29 08:00
創業訓練營,Education,25.041887272827672,121.5380125735412,臺北市大安區忠孝東路三段193巷 (旁),2016-12-06 10:00~2017-02-23 13:00
LFP: 個人化香水調香工作坊（2016 六月份6/12台北),Fashion,25.044545,121.5614574,110台北市信義區菸廠路88號六樓,2016-06-12 06:00~2016-06-12 09:00
【行銷恰恰】她經濟，正夯什麼?,Business,25.0518004,121.5319889,台北市南京東路二段100號12樓,2016-04-22 05:30~2016-04-22 09:00
《金曲售票演唱會》流行之夜,Entertainment,25.035675,121.567907,台北市信義區松壽路22號5樓,2016-06-22 11:00~2016-06-22 14:10
「New Marketing Age」新時代三部曲－創業X創新X創意,Education,25.0421106,121.53827780000006,台北市大安區忠孝東路三段1號 億光大樓2-3樓,2016-10-03 05:30~2016-11-30 10:00
【免費入場】2016親子童心園遊會-三創生活園區11樓,Education,25.0454815,121.53112729999998,台北市中正區市民大道三段2號11樓,2016-08-21 02:00~2016-08-21 08:00
商業數據分析與圖像表達│Excel樞紐分析與圖像說服,Education,25.020509,121.5436459,台大法學院霖澤館(辛亥路、復興南路口),2016-11-15 01:30~2016-11-15 08:30
大人的永續生活學：手作天然蜂蠟食物保鮮布 # 3,Health,25.0371108,121.5591243,台北市信義區仁愛路四段452巷6號1樓,2016-10-30 07:00~2016-10-30 09:00
【2016紐約廣告獎賞析會】-百件作品角逐國際 創意狂潮不設限,Business,25.038715,121.51871499999991,100台北市中正區中山南路11號,2016-07-29 05:30~2016-07-29 09:00
黑松親子DIY「猴力滿滿撲滿」,Charity,25.0460629,121.5441717,台北市復興南路一段39號2樓,2016-02-27 06:00~2016-02-27 08:30
2016台北踢踏節－踢踏研習營,Education,25.105994,121.51736699999992,臺北市北投區文林北路112號B1,2016-11-25 02:00~2016-11-30 15:00
G-Shock Taipei Bboy City World Final 2016 觀賽票預售,Sports,25.069098259892705,121.52435027832644,10452 臺北市中山區玉門街1號,2016-11-21 11:00~2016-12-17 01:45
【4G創業通】文創電商座談：行動時代的致勝關鍵,Business,25.0246244,121.54463740000006,台北市大安區和平東路二段134號,2016-01-10 05:00~2016-01-10 09:00
實境密室脫逃 《伊甸Ｉ：亞當覺醒》10月場,Entertainment,25.0650189,121.52406969999991,台北市中山區農安街19號地下一樓,2016-10-01 01:00~2016-10-31 15:00
HadoopCon 2016 (1) - 9/9 實作工作坊,Technology,25.041029957344634,121.61165146239624,台北市南港區研究院路二段128號,2016-09-09 01:30~2016-09-10 09:30
禾馨媽咪寶貝春日同學會,Other,25.067733,121.5816817,台北市內湖區民權東路六段42號,2016-05-22 05:30~2016-05-22 09:30
2016 BSI 管理標準年會,Technology,25.038485013642095,121.51787659858404,台北市中正區中山南路11號11樓,2016-11-01 00:30~2016-11-01 09:00
【改變一生英文公開課】collocations搭配詞 + 英文文法,Education,25.0498558,121.54358260000004,台北市朱崙街60號2樓,2016-04-22 11:30~2016-04-22 13:00
illuSalon｜Cama—當咖啡遇上插畫,Education,25.0413667,121.50236040000004,台北市萬華區康定路43號2樓,2016-01-17 06:30~2016-01-17 08:00
零售4.0！全通路時代的消費者洞察！,Business,25.0518004,121.5319889,台北市南京東路二段100號12樓,2016-04-27 06:00~2016-05-13 09:00
【5月5日第062場主題例會】當主播台被搬到品牌時代-- 三位主播一次到位，帶你運用品牌經營與媒體力量成功達陣！ | 與談: 周玉琴、林慧蓉；主持: 許   復,Business,25.0454815,121.53112729999998,台北市中正區市民大道三段2號11F,2016-05-05 11:00~2016-05-05 13:30
第十二屆流音之星全國高中職創作暨歌唱大賽-尋夢 初賽,Arts,25.0300992,121.51996710000004,台北市中正區羅斯福路一段94號B1,2016-11-04 16:00~2016-12-11 15:45
大人學/ProjectUP 11月讀友小聚,Entertainment,25.053209,121.5439493,台北市復興北路154號9樓【大人學台北教室】,2016-11-10 10:30~2016-11-10 13:30
薪年薪氣象．學而實習之 職場體驗實習X就業博覽會,Charity,25.0703276,121.52175390000002,臺北市中山區玉門街1號,2016-03-12 02:30~2016-03-12 08:00
[AIC-美國創新體驗館] 人人都是自造者,Education,25.043576978107165,121.55972550926208,台北市信義區光復南路133號,2016-10-16 06:00~2016-10-28 09:00
大人的釀酒學：啟動微醺開關術（午後）,Food,25.0371108,121.5591243,台北市信義區仁愛路四段452巷6號1樓,2016-08-24 06:30~2016-08-24 08:00
今年夏天我們在草原等你。玉樹6日深度旅遊,Travel,25.0983031,121.53285979999998,台北市士林區忠勇街39號(合和拾間),2016-08-13 22:00~2016-08-19 15:30
[插畫界]台北圖聚-採集者,Arts,25.0451389,121.53820100000009,台北市中山區八德路二段174巷28號,2016-08-21 05:00~2016-08-21 09:00
【8/21前人數統計】  916 X 菁英相遇 X 紳士限定   遊艇派對,Entertainment,25.0329636,121.56542680000008,台北市,2016-08-22 09:00~2016-09-16 15:00
A101 職場大人學：職場人際關係與優勢策略 台北場,Education,25.05321,121.5439301,台北市復興北路154號9樓【大人學台北教室】,2016-08-27 01:30~2016-08-28 09:30
《透視夢幻職業的一天》他們的工作=休閒娛樂！？,Education,25.0511507,121.53326070000004,台北市中山區松江路101號4樓,2016-08-27 06:00~2016-08-27 08:40
David Ko教你Scrum軟體開發 (7PDU),Education,25.0531388,121.5439473,台北市復興北路154號9樓【大人學台北教室】,2016-08-06 01:30~2016-08-06 09:30
illuClass｜手繪風電腦繪圖實作 ─ 入門篇,Education,25.0413667,121.50236040000004,台北市萬華區康定路43號2樓,2016-03-06 05:30~2016-03-06 07:00
捕捉瞬間 Sony A7系列相機體驗活動-AK Photo Studio場,Photography,25.079299,121.57175600000004,台北市內湖區洲子街76號(AK Photo Studio李文欽攝影工作室),2016-01-30 01:00~2016-01-30 13:00
從台灣到好萊塢特效之路&amp;國際最新CG後製流程分享會,Education,25.0419166,121.53885530000002,台北市忠孝東路3段197號旁(億光大樓2F感恩廳),2016-10-19 06:00~2016-10-19 09:00
互聯網＋來襲：行銷人如何應用數位科技、大數據、O2O全體驗行銷,Education,25.061033,121.544622,105台北市松山區復興北路365號B1,2016-08-26 11:30~2016-08-26 13:30
【台北新潮客】小眾文化新潮流,Arts,25.041218,121.51660200000003,台大醫院站 2 號出口,2016-07-23 08:00~2016-07-23 10:00
2016台灣大學野望影展,Education,25.015412846924228,121.5386035743744,台北市大安區羅斯福路四段一號 台灣大學生命科學館,2016-03-08 10:00~2016-04-19 13:00
illuClass｜實用印刷知識 — 完稿與選紙大解密,Education,25.0413667,121.50236040000004,台北市萬華區康定路43號2樓,2016-09-24 02:30~2016-09-24 04:30
資訊設計x圖像創作 - 活用你的視覺語言,Education,25.0406793,121.53244970000004,台北市中正區新生南路一段60號5樓,2016-03-26 05:30~2016-03-26 09:30
OPENMIND-網開全面,Arts,25.044545,121.5614574,台北市信義區菸廠路88號B2 (松菸誠品表演廳),2016-03-25 10:00~2016-03-25 14:30
CareerCube - 職業策展 -《食》食物旅程中的酸甜苦辣,Education,25.053384,121.51291259999994,台北市民權東路三段60巷7號,2016-10-30 06:00~2016-10-30 09:00
精彩退場 立即進場--致設計新鮮人 (台北場),Education,25.0436963,121.55934860000002,松菸文創園區 - 133號合作社 ( 台北市信義區光復南路133號 ),2016-06-04 01:30~2016-06-04 08:30
世界頂級酒莊巡禮-2016台北葡萄酒展X戀戀醉美電影套票,Entertainment,25.035487,121.56446699999992,台北市松壽路6號,2016-05-07 03:00~2016-05-08 11:00
空間經營者（場地人）交流座談,Education,25.0488463,121.56171029999996,台北市八德路四段123號3樓,2016-03-21 11:00~2016-03-21 14:00
天地人學堂： 品牌總監的思考與規劃技巧C,Education,25.0417491,121.5276814,台北市中正區齊東街74號（天地人文創）,2016-03-20 05:00~2016-03-27 10:00
&gt;&gt;FutureWard：Arduino Yun 物聯網工作坊,Technology,25.067131,121.52185239999994,台北市中山區中山北路三段40號,2016-03-22 11:30~2016-04-26 13:30
小編專門！職場設計輕鬆學！2場講座設計力up！,Education,25.0488463,121.56171029999996,台北市八德路四段123號3樓,2016-09-29 11:30~2016-10-06 13:30
【2016 校園巡迴講座】拒絕小確幸 開創大格局 - 東吳大學,Education,25.094415,121.545748,台北市士林區臨溪路70號,2016-05-05 04:30~2016-05-05 06:30
【Design Thinking 工作坊：車庫總監換你當！】——臺大創創週-想像共創・共創想像,Education,25.0138082,121.53017679999994,台北市中正區思源街18號,2016-05-01 01:00~2016-05-01 09:00
4/16(六) 好食分享會,Health,25.0525249,121.52970630000004,台北市南京東路二段53號7F,2016-04-16 06:00~2016-04-16 08:30
[AsukaBook Asia 好客日]國際品牌煉金術--攝影創業的成功之道,Photography,25.035814,121.50327590000006,台北市萬華區昆明街316號,2016-04-14 10:00~2016-04-14 13:30
【Simple Sofa分享會系列】第十二場 獨立小店的創業精神:拾米屋甜點咖啡X 55街精釀啤酒  小店精神X手作職人X創業旅程,Food,25.0512196,121.54765959999996,台北市南京東路三段338巷3號,2016-04-16 11:00~2016-04-16 13:00
【Ustar.M-12】電子廠童工到外商銀行副總 - 蛻變的職涯與品牌創業之路,Business,25.0406793,121.53244970000004,台北市新生南路一段60號B1,2016-01-19 11:30~2016-01-19 13:30
【響應 629世界工業設計日系列活動 】信義區香堤大道方矩間 The Square,Arts,25.034,121.56544039999994,臺北市信義區松智路、松仁路、松壽路、松高路之間,2016-06-24 05:00~2016-06-30 13:00
30學院【跨境電商系列課程】跨境電商‧翻轉100倍營業額,Business,25.0616308,121.53290360000004,台北市松江路350號,2016-05-06 11:00~2016-06-17 13:30
五月水土保持月—翻轉水保樂遊市圖,Education,25.029152,121.538369,臺北市建國南路二段125號,2016-05-28 06:00~2016-05-28 09:00
【數感任意門#2】買千送百的折扣陷阱,Education,25.0339538,121.54055040000004,台北市大安區信義路三段143號,2016-07-23 01:00~2016-07-23 04:00
Special K暖男派對-法比歐徵求廚房”貼身小幫手”熱烈報名中,Food,25.0421753,121.55249060000006,Dazzling Café  Pink店 (地址: 大安區忠孝東路四段205巷7弄11號),2016-05-18 04:00~2016-05-27 04:00
【沈方正@Cheers】7/29創新服務_台灣大車隊總經理 李瓊淑,Education,25.0409798,121.52076850000005,台大醫院國際會議中心402室(100台北市中正區徐州路2號),2016-05-25 10:30~2016-07-29 13:00
【數感任意門#1】A4紙中自有白銀屋,Education,25.0339538,121.54055040000004,台北市大安區信義路三段143號,2016-06-25 01:00~2016-06-25 04:00
為你而讀43會：Twitter創業X偏鄉教育Ｘ日本手工藝,Education,25.0389636,121.54923429999997,台北市大安區光武里敦化南路一段184號11樓,2016-05-15 06:00~2016-05-15 09:30
說出影響力│商業溝通影響力,Education,25.020509,121.5436459,台大法學院霖澤館(辛亥路、復興南路口),2016-05-27 02:00~2016-05-27 09:00
《3.0 講堂》冷凍空調國手ｘ培訓教師ｘ裁判長,Education,25.027421707619347,121.52991289087674,臺北市和平東路一段１２９之１號,2016-03-12 06:00~2016-03-12 09:20
智慧眼鏡開放創新與合作論壇,Technology,25.0584759,121.55487240000002,台北市民生東路四段133號14樓,2016-01-26 05:30~2016-01-26 09:30
【5月19日第064場主題例會】 新世代消費體驗：VR / AR虛擬與擴增實境的現在與未來 |  We JUMP總監 林閔瑩,Business,25.0454815,121.53112729999998,台北市中正區市民大道三段2號11F,2016-05-19 11:00~2016-05-19 13:30
LFP: 個人化香水調香工作坊（2016 七月份7/3台北),Fashion,25.044545,121.5614574,110台北市信義區菸廠路88號六樓,2016-07-03 06:00~2016-07-03 09:00
circle 兩週年講座，From do 2 talk,Arts,25.0436839,121.55935,台北市信義區光復南路133號2F,2016-07-09 06:00~2016-07-29 16:00
【C級台北場】7/2~7/3 肌內效C級貼紮課程 ─ 6/24報名截止,Education,25.0660098,121.51565749999996,台北市大同區昌吉街55號2樓207教室,2016-07-02 00:30~2016-07-03 09:30
【華山論劍社企講堂020】​現代工作者必懂的十個人資議題,Education,25.02979,121.52861499999996,台北市金華街142號,2016-10-13 11:30~2016-10-13 13:00
Not Just Library | 英國短片導演George Wu講座 - This isn’t my beautiful house - Letting go of your career ideals and smiling,Arts,25.044011432590857,121.56066008292235,松山文創園區 | 台北市信區光復南路133號,2016-02-20 05:30~2016-02-20 08:00
本活動已額滿，感謝大家踴躍報名！《My EMBA講堂》「30年教我的事」研討會,Business,25.012971,121.536381,台大集思會議中心(台北市大安區羅斯福路四段85號B1),2016-09-08 06:00~2016-09-08 09:00
「不只灣味Not Only One Way」系列講座,Education,25.024566069917707,121.54455156931158,臺北市大安區和平東路二段134號,2016-10-24 16:00~2016-11-29 16:00
《再見瓦城》電影跨界講座【從電影夢到台灣夢，從台灣夢到世界夢】 趙德胤 X 周永明,Arts,25.0325203,121.56585359999995,台北市信義路五段100號B1,2016-12-10 06:00~2016-12-10 08:00
健心房──你的心理鍛鍊計劃！,Education,25.026631,121.55676700000004,台北市信義區嘉興街179-28號1樓,2016-10-01 12:00~2016-10-31 14:00
漢娜妞《我的婚禮籌備日誌》新書分享・簽名會,Travel,25.0394812,121.56584680000005,台北市信義區松高路11號3樓,2016-06-03 11:30~2016-06-03 13:30
虛擬實境遊戲設計與製作開發實務班,Technology,25.0418977,121.52566160000003,台北市中正區濟南路一段 321 號 行政大樓四樓402,2016-07-01 10:30~2016-07-30 10:00
IT IS ALL ABOUT LOVE 為愛發聲公益演唱會,Charity,25.035675,121.567907,台北市松壽路22號5樓,2016-04-30 11:30~2016-04-30 14:00
【台北愛喫客】永康在地小店大搜索,Arts,25.0335642,121.5295003,捷運東門站5號出口,2016-08-20 06:00~2016-08-20 08:00
【 IoT應用系列】Ameba x Seeed Grove雲端整合工作坊,Technology,25.022136,121.54797699999996,台北市大安區敦化南路二段216號23樓,2016-01-23 02:00~2016-01-31 09:00
知識學苑系列─銀髮服務經濟,Education,25.042403,121.512201,台北市衡陽路51號3樓 （基泰國際商務中心）,2016-04-18 16:00~2016-08-18 15:59
Baby kitchen-三創週年慶 感恩烘焙課程,Food,25.0454815,121.53112729999998,台北市中山區市民大道三段2號7f 咖啡芭蕾,2016-05-07 03:15~2016-06-19 04:30
健康聚聚 –鄭雲龍《「脊」樂抒壓》,Health,25.0228309,121.53419209999991,臺北市大安區新生南路3段30號,2016-03-13 06:00~2016-03-13 08:00
【劇本講座】 故事！無所不在－談劇本與應用,Arts,25.0436519,121.51306899999996,台北市重慶南路一段66號9樓,2016-04-19 11:30~2016-04-19 13:00
【C級台北場】11/12~11/13 肌內效貼紮課程─11/4報名截止,Education,25.0660098,121.51565749999996,台北市大同區昌吉街55號2樓207教室,2016-11-12 00:30~2016-11-13 09:30
PitchCamp 2016 決勝創投：共同見證台灣創業簡報巔峰對決,Business,25.0454815,121.53112729999998,10058台北市中正區市民大道三段2號,2016-05-22 05:00~2016-05-22 10:00
illuClass｜手繪風電腦繪圖實作 ─ 入門篇,Education,25.0413667,121.50236040000004,台北市萬華區康定路43號2樓,2016-05-05 11:30~2016-05-05 13:00
【從心出發 活出精彩】2016醫師幸福一日營,Education,25.041965035285,121.53831298095088,億光大樓2樓 感恩廳-台北市忠孝東路三段193巷旁,2016-04-24 00:00~2016-04-24 09:00
一半海水一半火焰： 萬里行記之歐陸篇,Travel,25.054741,121.54288099999997,台北市中山區長春路311-1號1樓,2016-01-02 10:30~2016-01-02 13:00
GAP 17 使命感教育討論會,Education,25.0169587,121.53385070000002,臺北市羅斯福路四段一號,2016-10-21 11:00~2016-12-09 13:30
玩瘋動畫夏令營,Education,25.0406793,121.53244970000004,台北市新生南路一段60號5樓,2016-07-25 01:00~2016-07-30 08:00
BIG Camp | SPRING 2016: Grow your startup FAST!,Technology,25.0454815,121.53112729999998,台北市中正區市民大道三段2號11F,2016-05-09 01:30~2016-05-11 10:30
2016 CODE Award 作品賞析會-觀摩日本原創脈動,Business,25.038715,121.51871499999991,100台北市中正區中山南路11號 (臺大醫院捷運站一號出口),2016-09-09 05:30~2016-09-09 09:00
認識動物溝通講座＿2016/5/28 台北場,Other,25.0223013,121.5230692,100金門街12巷7號,2016-05-28 11:00~2016-05-28 14:00
204 動態排程進階 - 個案工作坊 (7PDU),Education,25.052848,121.54435149999996,台北市復興北路99號 (上課樓層請留意1F指示牆公告)【恆逸資訊】,2016-07-09 01:30~2016-07-09 09:30
【2016Maker Faire】LASS社群自造成果分享會,Technology,25.0961275,121.51668740000002,台北市士林區士商路189號,2016-05-07 05:30~2016-05-07 08:30
【台北場】FB 操作訣竅- 10月iCHEF CLUB大講堂,Education,25.0488463,121.56171029999996,CLBC大船艦 ( 台北市八德路四段123號3樓 ),2016-10-12 06:00~2016-10-12 09:00
(已額滿)尋找完美伴侶的系統化做法(3小時版),Education,25.053145,121.543682,台北市復興北路154號9樓 (大人學台北教室),2016-01-27 10:30~2016-01-27 13:30
踏進紳士的第一步從這開始，GQ紳士講堂招生中！,Fashion,25.0488463,121.56171029999996,台北市松山區八德路四段123號3樓,2016-07-03 10:00~2016-07-03 13:30
【台以新創分享會】以色列憑什麼在新創發展上勝出,Business,25.0441499,121.52944079999996,台北市八德路一段1號,2016-11-17 11:30~2016-11-17 13:00
安心感男孩。177cm↑男生限定聯誼活動♥,Entertainment,25.0297089,121.51977009999996,台北市福州街11號,2016-06-04 10:30~2016-06-04 13:00
【創業小聚#64】掌握溝通技巧，打破工程師與設計師的平行時空！,Business,25.0435203,121.5574173,YOUR SPACE：台北市大安區光復南路102號3樓,2016-04-20 11:00~2016-04-20 13:30
女子比屈歌舞秀Bitch Cabaret,Arts,25.0441499,121.52944079999996,台北市中正區八德路一段1號,2016-12-23 11:00~2016-12-25 14:00
岱我飛翔—我的棒球路  國泰陽岱鋼分享會,Sports,25.0464839,121.54097890000004,台北市八德路二段260號3樓,2016-01-08 11:30~2016-01-08 12:30
故事學堂：臺史博x故事網站  巡迴講座,Education,25.017524,121.53316100000006,聯經書房(台北市新生南路三段94號B1),2016-05-28 07:00~2016-08-27 09:00
A103履歷優化實戰班,Education,25.053145,121.543682,台北市復興北路154樓9樓【大人學台北教室】,2016-06-25 01:30~2016-06-25 09:30
大人學品味：專業男士的西裝知識,Education,25.053145,121.543682,台北市復興北路154樓9樓【大人學台北教室】,2016-06-19 06:00~2016-06-19 09:00
【六月人才講堂】鍾子偉_新媒體X心視野,Education,25.0493663,121.57900510000002,台北巿信義區巿民大道六段288號4F,2016-06-27 10:00~2016-06-27 13:00
數位行銷學院￨Facebook社群經營精準行銷術,Education,25.012971,121.536381,集思台大會議中心國際會議廳(台北市羅斯福路四段85號地下1樓),2016-03-04 01:30~2016-03-04 08:50
How Do You Build a Unicorn-Meet with 4-Time Forbes Midas Lister VC Hans Tung,Education,25.0339226,121.56463680000002,台北市信義路五段7號83F,2016-12-21 18:30~2016-12-21 20:30
天使面對面創業論壇,Business,25.04454,121.55561579999994,106台北市大安區市民大道四段198號（饌巴黎星光攝影棚）,2016-07-23 05:30~2016-07-23 13:30
MG聚『給社會新鮮人的震撼彈』,Other,25.0796919,121.55135500000006,台北市中山區明水路569號B2,2016-05-14 10:30~2016-05-14 14:30
「和土地談戀愛」- 蹲點台灣  巡迴影像故事展：好丘信義店分享會,Charity,25.0313617,121.56191119999994,台北市信義區松勤街54號,2016-01-21 10:30~2016-02-02 11:30
2016誠品曬書市集【尋書啟事】,Arts,25.083576,121.55709849999994,台北市中山區敬業三路20號,2016-05-11 03:00~2016-05-23 14:00
窩講堂#03 無盡的迴圈--流浪動物解方的雙面刃,Charity,25.0454815,121.53112729999998,三創11樓 貝殼好室Event Space A：台北市中正區市民大道三段2號,2016-06-05 05:00~2016-06-05 09:00
夏日黃金週 邏輯探索夏令營 程式設計x數學桌遊,Education,25.0383825,121.54968239999994,台北市大安區仁愛路四段107號4樓,2016-07-18 01:00~2016-07-22 09:00
Google Analytics網站分析基礎實務｜網站分析必備工具,Education,25.0228309,121.53419209999991,臺北市大安區新生南路3段30號1F,2016-06-24 01:30~2016-06-24 09:30
