title,cate,lat,lng,addr,date
親子電影故事森林－《翻滾吧！男孩》,Entertainment,25.0453633,121.53098899999998,台北市中正區市民大道三段2號五樓,2016-02-01 04:00~2016-02-12 11:00
【打造金頭腦 考試必勝班】試聽講座,Education,25.0487212,121.5270769,台北市中山區長安東路一段61-1號,2016-01-30 11:30~2016-01-30 13:30
【免費旅遊講座】1/23（六）《在泰北發現天堂：清邁．拜城．清萊》新書分享會,Travel,25.0129707,121.5349112,台北市汀州路3段184號B1,2016-01-23 07:00~2016-01-23 09:00
日本不動產 日本房地產,Education,25.0487857,121.51856900000008,台北市大同區市民大道1段209號11樓,2016-01-09 06:00~2016-01-09 08:00
品咖啡活動_"品味+健康"的樂活生活型態_現場品嘗三款精品咖啡,Food,25.0346926,121.542277,台北市大安區信義路三段147巷11弄6-1號,2016-01-04 06:00~2016-01-08 08:00
​人本2016寒假系列活動,Other,25.0196073,121.52963980000004,台北市大安區羅斯福路三段227號9樓,2016-01-05 01:00~2016-02-04 01:00
免費2.5小時陳光 記憶 特訓講座,Education,25.025943,121.52285000000006,台北市中正區羅斯福路2段136號3樓,2016-01-02 06:00~2016-01-02 08:30
Maker x 物聯網實戰分享講座,Education,25.0463287,121.5148673,台北市館前路2號5樓,2016-01-06 11:00~2016-01-12 13:00
2016/1/9 (六) 場次A : 對愛情認真+工作穩定     優質型男約會六尾七年級女孩,Other,25.0329636,121.56542680000008,台北市,2016-01-09 06:30~2016-01-09 09:30
【泰國地產投資說明會(01/09台北世貿場)】,Business,25.033263,121.56049180000002,台北市信義區信義路五段一號四樓,2016-01-09 06:00~2016-01-09 08:00
2016思想地圖實踐計畫,Other,25.0290066,121.52650700000004,台北市大安區金山南路二段165號4樓,2016-01-05 01:00~2016-02-25 16:00
104年青年就業讚政府補助專案,Education,25.0444537,121.51683520000006,台北市公園路30號,2016-01-07 10:30~2016-01-07 13:30
YK CLUB| 紓壓系列 俄羅斯傳統工藝/ Dymkovo toys/ 德姆科沃小泥人,Arts,25.026631,121.55676700000004,台北市信義區嘉興街179-28號,2016-01-10 10:00~2016-01-17 13:00
百貨公司進櫃心法,Business,25.0273353,121.51535749999992,青創總會,2016-11-30 05:30~2016-11-30 09:30
全台官方限定課程-(台北班)LINE@行銷活用實戰班,Education,25.0273353,121.51535749999994,青創總會(台北市中正區和平西路一段150號12樓),2016-11-28 01:30~2016-11-28 08:30
產品創意行銷術,Education,25.0273353,121.51535749999994,台北市和平西路一段150號12樓,2016-11-30 10:30~2016-11-30 13:30
手工糖霜餅乾DIY---【基礎課】米妮米奇,Food,25.0589717,121.53392770000004,台北市中山區松江路235巷7號,2016-04-14 05:00~2016-04-14 10:00
汽車設計講座 _ 汽車設計師的夢想使命！,Education,25.0436519,121.51306899999996,台北市重慶南路一段66號9樓,2016-04-18 11:30~2016-04-18 13:00
第一次當房東就上手,Education,25.052848,121.54435149999996,台北市復興北路99號15樓,2016-04-13 11:00~2016-04-13 13:00
『商業髮型秀model』4/16,Fashion,25.0286611,121.50530070000002,台北市中正區中華路二段,2016-04-16 03:00~2016-04-16 04:30
印度香料的橙黃春天,Food,25.020609,121.52770899999996,台北市中正區羅斯福路三段126號-2,2016-04-17 06:30~2016-04-17 07:30
【WOWMAN 女勢系列活動】女嗜-輕巧好食光,Food,25.044545,121.5614574,台北市信義區菸廠路88號,2016-04-13 02:00~2016-05-15 14:00
4/16(六)美國NLP大學獨家授權-NLP專業執行師認證課程說明&amp;分享會(免費參加),Education,25.0440101,121.52576039999995,台北市忠孝東路1段150號3F (善導寺捷運站5號出口),2016-04-16 06:00~2016-04-16 09:00
【WOWMAN 女勢系列活動】女仕-女仕靈魂樂,Arts,25.044545,121.5614574,台北市菸廠路88號,2016-04-13 03:00~2016-05-15 14:00
4/16 如何穿出女神焦點,Education,25.0630378,121.52139899999996,台北市民權西路27號9樓,2016-04-16 11:00~2016-04-16 13:00
數位音樂講座之音樂會友活動,Education,25.002185,121.539124,台北市羅斯福路五段215號3樓,2016-04-16 10:30~2016-04-16 12:30
contiki 台北說明會 4.16(六),Travel,25.0413091,121.5493906,台北市大安區忠孝東路四段142號6樓,2016-04-16 06:00~2016-04-16 08:00
漆騙 仿金屬管燈架　（台北場）,Arts,25.0958475,121.52558180000004,111台北市士林區福壽街13號,2016-04-16 05:00~2016-04-16 08:00
90 DAY TRAINING-綜合肌力訓練,Sports,25.047677,121.549351,台北市松山區敦化南路一段1號6樓B座,2016-06-09 01:00~2016-06-09 04:00
現代人文占星-十二星座概論 五月週日全天課程,Education,25.0609225,121.53510389999995,台北市中山區建國北路二段226巷48號1樓,2016-05-22 02:30~2016-05-29 09:30
5/23『領導力加速器』一階課程說明會─踏上人生自我實現之路,Education,25.0124351,121.53614600000004,台北市中正區羅斯福路四段160號B1,2016-05-23 11:00~2016-05-23 14:00
網路中文 第十屆域名研討會 [台北場],Technology,25.0375759,121.52464800000008,台北市中正區杭州南路一段24號,2016-11-23 01:30~2016-11-23 08:30
一個『影響自己未來』的遊戲。,Education,25.032406,121.51824399999998,捷運中正紀念堂站2號出口,2016-11-27 10:30~2016-11-27 13:30
《複利！真的是奇蹟！？》,Education,25.0329636,121.56542680000008,台北市,2016-11-26 17:00~2016-11-27 15:00
【以書會友 】輕鬆聊天讀書會,Education,25.032406,121.51824399999998,中正紀念堂二號出口,2016-11-21 11:30~2016-11-21 13:30
企業魂~ 創造之旅 (台北場11/27-11/29),Education,25.042049,121.57962700000007,台北市信義區忠孝東路五段669號B2,2016-11-27 01:00~2016-11-29 11:00
從0到1 邊玩邊工作旅遊創業KNOW-HOW座談會,Business,25.051885,121.5294847,台北市南京東路二段36號7樓,2016-11-21 10:30~2016-11-21 12:30
【街遊 Hidden Taipei】 城中時光散步 》2016-07-10,Travel,25.042634,121.508778,台北市中正區中華路一段55號,2016-07-10 06:00~2016-07-10 08:30
【經典好書一起讀-023】《從賈伯斯到馬斯克》7/30(週六)晚上七點,Education,25.0701378,121.5185202,台北市大同區承德路三段２１９號三樓,2016-07-30 11:00~2016-07-30 13:00
3D列印參數設定實務與未來發展,Education,25.0323399,121.49820610000006,台北市萬華區西園路二段9號3F (西園29服飾創作基地),2016-07-13 01:00~2016-07-13 08:00
誠品網路書店 X 肯園 ANIUS 夢想氣味講堂-【芳繚師】7/10（日） 15:00-16:00,Health,25.0194887,121.5321702,台北市大安區溫州街 74 巷 3 弄 1 號,2016-07-10 07:00~2016-07-10 08:00
人資法令講座：職業災害與補償,Education,25.0548327,121.52298919999998,台北市松山區長春路339巷2號B1樓,2016-07-15 06:30~2016-07-15 09:00
大人的釀酒學：自選水果釀酒術(七月平日加開場）,Food,25.0371108,121.5591243,臺北市信義區仁愛路四段452巷6號1樓,2016-07-13 06:00~2016-07-13 08:00
多語咖啡華語練習與教學研究活動,Arts,25.0511271,121.53388459999996,台北市中山區南京東路二段138巷17號,2016-07-14 09:00~2016-07-14 11:00
【肌內效EX貼紮入門實作班】7/28台北場-7/22報名截止,Education,25.0660098,121.51565749999996,台北市大同區昌吉街55號2樓207教室,2016-07-28 11:30~2016-07-28 13:00
澄靜的力量--助人者心靈澄靜工作坊,Education,25.090478,121.5254509,臺北市士林區大東路75號,2016-07-30 06:00~2016-07-30 13:00
【貓頭鷹博士數位學堂】快速上手網路行銷（密集班）,Business,25.0124351,121.53614600000004,100台北市中正區羅斯福路四段160號,2016-07-23 02:00~2016-07-23 09:00
【櫞椛研習室】《藝術與教育系列之三：閱讀，時間之書》給20/30/40的你,Education,25.0486563,121.52050859999996,台北市中山區中山北路一段56巷2-1號2樓,2016-07-10 06:00~2016-07-10 07:30
(台北班)LINE@口袋商店:全新電商平台，幫您掌握行動商機！,Education,25.0273353,121.51535749999994,台北市和平西路一段150號12樓,2016-07-29 10:30~2016-07-29 13:30
《療癒密碼》作者亞歷山大．洛伊德博士 首度來台講座,Education,25.0409798,121.52076850000005,台大醫院國際會議中心201室 (100台北市中正區徐州路2號),2016-07-20 11:00~2016-07-20 13:30
不要點！這是『預見未來』的遊戲！,Education,25.032406,121.51824399999998,捷運中正紀念堂站2號出口,2016-07-28 11:00~2016-07-28 14:00
德。奧－【聖誕市集】特別講座,Travel,25.0523129,121.537779,台北市南京東路三段21號2樓,2016-07-23 06:00~2016-07-23 09:00
開心玩~樂~學~桌遊Nolimit!!!進階版,Entertainment,25.0658617,121.53048869999998,台北市吉林路399號B1,2016-07-21 10:30~2016-07-21 13:30
James的快樂水彩課,Arts,25.046121,121.55194340000004,台北市105台北市松山區八德路三段12巷51弄36號B1,2016-07-22 11:30~2016-07-22 13:00
實戰交易員徵選計畫,Education,25.029633,121.52690499999994,台北市金山南路二段141巷1號1樓,2016-07-26 02:00~2016-10-31 02:00
法式科學芳香療法「多米尼克．柏杜博士皮膚醫學講座」說明會,Education,25.0517818,121.5342256,104台北市中山區南京東路二段150號10樓,2016-07-16 06:00~2016-07-16 07:00
【五行開運入門】教您如何運用五行設計貼身運飾,Education,25.0491765,121.536064,台北市中山區長安東路二段129巷13號1樓,2016-07-23 06:00~2016-07-23 08:00
製作屬於自己的WordPress網站_假日班03,Education,25.0244344,121.53029590000006,106台北市大安區泰順街40巷15之3號,2016-07-16 01:00~2016-07-17 08:00
眼前的黑不是黑,Education,25.005664,121.53889959999992,羅斯福路(中正紀念堂2號出口),2016-07-17 05:30~2016-07-17 09:00
假日運動派對-90分鐘夏季瘋運動,Sports,25.047677,121.549351,台北市松山區敦化南路一段1號6樓B座,2016-07-24 07:00~2016-07-24 09:00
Salesforce CRM 3小時免費入門課程-實機操作(2016年7月課程),Education,25.0328684,121.5597437,台北市信義區信義路五段2號13樓B,2016-07-07 06:00~2016-07-07 09:00
好幫小學堂-芳香呵護(ㄧ) 手的溫暖印記,Health,25.02979,121.52861499999996,106台北市金華街142號,2016-07-02 02:00~2016-07-02 03:30
爾雅-夏至三伏之祛濕運動,Health,25.0392311,121.5439523,台北市大安區復興南路一段215號12樓,2016-07-06 11:00~2016-07-06 12:30
Yoga Journey 空中瑜珈初學者課程,Health,25.0464859,121.5483306,台北市松山區敦化南路一段90號,2016-07-08 11:30~2016-07-08 12:30
技術分析初級班,Education,25.0438124,121.52258660000008,台北市青島東路7號5樓之1,2016-07-07 06:30~2016-08-11 09:00
開心玩~樂~學~桌遊Nolimit!!!,Entertainment,25.0658617,121.53048869999998,台北市吉林路399號B1,2016-07-07 10:30~2016-07-07 13:30
7/6『Top24 Fashion model』,Fashion,25.040836,121.54219710000008,台北市忠孝東路三段248巷13弄11號,2016-07-06 11:00~2016-07-06 13:30
船的味覺分享會 Part II：具有特別生命意義的料理(澎湃甜點版),Arts,25.134127,121.50270899999998,Solo Singer Life CAFE (台北市北投區溫泉路7巷 1弄 1號),2016-07-10 07:00~2016-07-10 09:00
2016台北國際軟體應用展「雲端創新應用」專區,Business,25.0332591,121.562324,台北市信義路五段5號,2016-07-01 02:00~2016-07-04 10:00
【 N.129場跨產業沙龍－全台最大的每週跨界交流論壇】,Education,25.0417491,121.5276814,台北市中正區幸福里齊東街74號1樓,2016-07-06 11:00~2016-07-06 13:30
劉坤圖-土地投資淘金術,Education,25.042403,121.512201,台北市中正區衡陽路51號7F之9,2016-07-01 11:00~2016-07-29 13:00
Amazon開店實戰班,Education,25.0273353,121.51535749999994,台北市和平西路一段150號12樓,2016-10-29 01:30~2016-10-29 08:30
Mason GRE密集班免費公開課程 7/3(日)場次,Education,25.0331622,121.54418420000002,台北市大安區信義路四段6號11F,2016-07-03 10:45~2016-07-03 13:00
天地人學堂：義式提拉米蘇 實作坊#1,Education,25.0415885,121.52769809999997,台北市中正區齊東街57號（天地人文創,2016-07-07 11:00~2016-07-07 14:00
2016兒童領袖情緒營-北區,Education,25.066791,121.5335301,台北市中山區松江路473號4樓,2016-07-06 01:00~2016-07-08 09:00
【夏日限定】夏日清爽潔淨DIY手作課程,Education,25.059837,121.5184352,台北市承德路二段215號2樓之3 (近台北車站),2016-07-07 05:00~2016-07-26 14:00
2017海外志工招募說明會：斯、柬、尼、菲、日,Travel,25.026086,121.52857599999992,台北市師大路186巷9號3樓,2016-09-24 04:00~2016-10-25 01:00
illuSalon｜開始品牌經營之路,Education,25.0413667,121.50236040000004,台北市萬華區康定路43號2樓,2016-08-16 09:30~2016-08-16 13:00
2016台北醫學大學健康熱門精選課程,Education,25.0259514,121.5612671,110台北市信義區吳興街250號,2016-08-16 16:00~2016-10-14 16:00
Aerial Dance workshop -Jazz,Sports,25.0633227,121.5195691,臺北市中山區撫順街28號,2016-08-13 04:30~2016-08-13 06:00
【街遊 Hidden Taipei】 西門王的漲跌人生 》2016-08-14,Travel,25.0423859,121.50709699999992,台北市萬華區成都路12號,2016-08-14 08:00~2016-08-14 10:00
【影迷輕鬆看】8月『北歐風格面面觀』主題放映會-變調青春,Arts,25.0215342,121.49246500000004,大可樂DuckLab(大可居青年旅館B1-台北市萬華區明街316號),2016-08-11 11:30~2016-08-11 13:30
【夏令營】Kid’s IPO – 兒童理財營,Education,25.0336762,121.54259790000005,台北市大安區信義路三段153號七樓,2016-08-17 01:00~2016-08-18 09:00
StudyMAP即將揭曉你所不知道的隱藏版遊學秘境！台北+高雄分享會,Travel,25.0460494,121.51487270000008,台北市中正區館前路6號8樓之6,2016-08-20 05:30~2016-08-20 07:30
歐盟「數位單一市場」跨境電商英德市場大揭密,Business,25.033263,121.56049180000002,台北市信義區信義路五段1號,2016-08-18 05:00~2016-08-18 10:30
【周二Tue】吟詩打拳-唐詩功夫體驗活動(9月靜夜思),Sports,25.051284,121.5601795,台北市松山區南京東路五段52號2樓,2016-09-01 02:00~2016-09-30 12:00
「小小 les petits」視覺設計聯展,Arts,25.0326625,121.5146949,台北市重慶南路二段19巷3號（國北教大 南海藝廊）,2016-11-20 09:00~2016-11-25 13:30
作文師資研習班 ( 創意作文教學 ),Education,25.0289837,121.5282605,台北市台北市麗水街28-1號1樓,2016-03-07 02:00~2016-06-08 04:30
【免費優惠券】Tourwoods 下載APP就送500元住宿優惠券,Technology,25.0284787,121.55700409999996,110 台北市信義區基隆路2段125號10樓,2016-03-10 16:00~2016-03-29 15:45
減重挑戰賽-舒緩瑜珈之夜,Sports,25.047677,121.549351,台北市松山區敦化南路一段1號6樓B座,2016-03-08 10:00~2016-03-08 13:00
阿瓦隆之夜-魔法嘴砲歡樂桌遊團(諾丁漢警長，一夜狼人),Entertainment,25.0487212,121.5270769,台北市中山區長安東路一段61-1號1F,2016-03-10 11:30~2016-03-10 14:30
評估土地價值，投資買對不要買貴！,Education,25.042403,121.512201,台北市中正區衡陽路51號7F之9,2016-03-03 11:00~2016-03-03 13:00
薛仁明/古漢人的生命氣象(一) (2016.3.5開課),Arts,25.0430847,121.51016759999992,100台北市中正區延平南路98號中山堂三樓,2016-03-05 06:00~2016-05-28 09:00
好玩、有趣運動減重party,Sports,25.047677,121.549351,台北市松山區敦化南路一段1號6樓B座,2016-03-01 01:00~2016-03-01 04:00
【網路創業開店人才培訓講堂】-經營與行銷策略(台北場),Business,25.038715,121.51871499999991,台北市中正區中山南路11號,2016-03-10 06:00~2016-03-10 08:00
外匯投資聖杯講座 - 03/05 (六) 台北場次,Education,25.0622348,121.51557430000004,私塾空間 - 台北市大同區民權西路104號10樓-1 (民德大樓 ),2016-03-05 06:00~2016-03-05 08:00
【Fun空塗鴉本之LOve MOre】,Arts,25.0406559,121.53799200000005,台北市大安區建國南路一段１７７號,2016-03-02 02:00~2016-03-13 08:00
將至的腦補 Got it-not yet,Arts,25.10583926953094,121.5220804374344,臺北市士林區福華路180號,2016-03-17 02:00~2016-04-24 10:00
免費2.5小時陳光 NBU記憶體擴充法-基礎班,Education,25.025943,121.52285000000006,台北市中正區羅斯福路2段136號3樓,2016-03-12 06:00~2016-03-12 08:30
說故事工作坊-創造語言的力量,Education,25.0583591,121.54963499999997,台北市敦化北路303號3樓-2,2016-03-16 11:30~2016-03-16 13:30
&gt;&gt;FutureWard：復古小酒館燈具,Arts,25.0668623,121.52233030000002,台北市中山區中山北路三段40號,2016-03-20 02:00~2016-03-20 10:00
免費LINE BRUSH 插畫教學,Education,25.0242264,121.52794319999998,台北市師大路68巷9號,2016-03-20 06:00~2016-03-20 08:00
*印花午茶會* 在身上的跳舞姿態-印花風格肩背提袋/台北大稻埕場,Arts,25.0563507,121.5107789,台北市大同區民樂街28號,2016-03-19 06:00~2016-04-09 08:00
餐飲創業實戰班-餐飲業的品牌規劃,Education,25.0273353,121.51535749999994,台北市中正區和平西路一段150號12樓,2016-11-16 05:30~2016-11-16 08:30
全新社交體驗《FLIP! 實境桌遊》,Entertainment,25.054741,121.54288099999997,104 台北市中山區長春路311-1號1樓,2016-11-20 05:00~2016-11-20 09:00
管科會-數位時代的經營新思維  研討會,Education,25.0316869,121.53298999999993,台北市新生南路30號,2016-11-17 05:00~2016-12-17 09:00
國父紀念館 陽光桌遊 固定 桌遊團 『桌遊』,Entertainment,25.0452888,121.55640930000004,臺北市松山區光復南路66巷28,2016-11-17 06:00~2016-11-17 14:00
顛覆藝術收藏市場-你所不知的藝術電商,Arts,25.022136,121.54797699999996,台北市大安區敦化南路2段216號23樓,2016-11-18 11:10~2016-11-18 12:40
(停開)【達人】ALEX影像的結構與構圖分析,Photography,25.0453633,121.53098899999998,台北市中正區市民大道3段2號4樓,2016-03-18 11:00~2016-03-18 13:00
互聯網創業平台,Other,25.0659212,121.5178661,台北昌吉街一號,2016-03-30 12:00~2016-03-30 13:45
倍數銷售 講座研習,Business,25.0802201,121.5740763,台北市內湖區內湖路一段516號6樓,2016-03-28 11:00~2016-03-28 13:30
Etu &amp; udn Hadoop Competition 2016,Technology,25.0765969,121.5735621,台北市內湖區瑞光路318號,2016-03-30 01:00~2016-05-06 09:00
《Alternative Vision》 另一觀點,Arts,25.0426189,121.5133601,台北市重慶南路一段113號3F,2016-03-26 03:00~2016-05-22 11:00
小王子的漂浮時光：氣泡雞尾酒教室,Arts,25.03331,121.53239299999996,台北市大安區新生南路二段2號6樓,2016-03-25 11:30~2016-03-25 13:30
蘋果問題解決日 ［3 月 27 日天母場］,Education,25.1173571,121.53397159999996,台北市士林區忠誠路2段206號B1,2016-03-27 06:30~2016-03-27 09:30
F6-NRW 3月份一日訓,Education,25.0659212,121.5178661,台北市大同區昌吉街1號,2016-03-26 01:00~2016-03-26 07:00
從【星盤】看見你【加速進步】的關鍵時刻座談會,Education,25.043716,121.54422010000008,台北市大安區復興南路一段103號12樓之7,2016-03-31 06:00~2016-03-31 08:00
脈輪繪畫靜心課程,Education,25.0609225,121.53510389999995,台北市中山區建國北路二段226巷48號1樓B室,2016-03-26 06:00~2016-03-26 08:00
【 NLP 催眠式溝通銷售講堂 】,Education,25.0487212,121.5270769,台北市中山區長安東路一段61-1號,2016-03-25 11:30~2016-03-25 13:30
Daisy Day手作創業雙證照輔導班x國立台北商業大學,Education,25.0418977,121.52566160000003,台北市濟南路一路321號,2016-03-29 11:00~2016-05-17 14:00
品牌行銷與價值銷售研討會,Education,25.0480404,121.5493722,台北市八德路三段2號5F-501教室,2016-04-23 01:00~2016-04-24 10:00
Cafe English：James時事討論課,Arts,25.0530499,121.54730799999992,台北市松山區南京東路三段303巷8弄11號,2016-02-24 11:30~2016-02-24 13:00
【台北殘扶險基礎班】有長照雙法更要有殘扶險,Education,25.0448979,121.51515410000002,台北市中正區館前路49號4樓,2016-02-23 01:30~2016-02-23 04:00
【2/27 (六) 輕鬆壓出好咖啡】* 贈法國壓,Education,25.0424801,121.56494539999994,台北市信義區基隆路一段178號6F (APP Works),2016-02-27 02:30~2016-02-27 04:00
網路創業真E A S Y !!,Business,25.0659212,121.5178661,台北市昌吉街1號,2016-02-24 11:30~2016-02-24 13:00
一場理財遊戲，如何創造我們的現金流,Education,25.032406,121.51824399999998,捷運中正紀念堂站2號出口,2016-02-28 05:30~2016-02-28 08:30
免費NLP課程,Education,25.059837,121.5184352,台北市大同區承德路二段215號2樓3,2016-02-24 06:00~2016-02-24 08:00
農地、農舍買賣,Business,25.042403,121.512201,台北市衡陽路51號7樓之9,2016-02-23 11:00~2016-02-23 12:30
【 N.110場跨產業沙龍－全台最大的每週跨界交流論壇】,Education,25.0417491,121.5276814,台北市中正區幸福里齊東街74號1樓,2016-02-24 11:00~2016-02-24 14:00
免費演講: 神奇的溝通,Education,25.051028,121.56956300000002,台北市松山區南京東路五段354號1樓*2747-0001葉小姐,2016-02-22 08:00~2016-02-22 09:00
餐廳隨意拍，分享聚人潮！_餐廳小聚 in 台北,Food,25.0402386,121.5479712,台北市大安區敦化南路一段238巷1號,2016-02-23 06:00~2016-02-23 08:00
Ozobot路徑機器人--幼兒思考力趣味課程（3小時週日上午梯次）,Education,25.0274811,121.52095680000002,台北市中正區羅斯福路二段66巷21號1樓,2016-01-10 01:30~2016-01-10 04:30
葡萄酒入門課程 2,Education,25.0512976,121.540436,台北市龍江路76巷1號,2016-01-04 11:00~2016-01-04 13:00
Ryan Rose's Kitchen：Vietnam Pho,Arts,25.026631,121.55676700000004,台北市信義區嘉興街179-28號,2016-02-02 11:00~2016-02-02 13:00
(免費讀書會交流)有錢人跟你想的不一樣,Education,25.027535,121.52237100000002,台北市大安區羅斯福路二段45號,2016-02-04 11:30~2016-02-04 13:00
Climate Chat - 春季農業氣候預測,Other,25.0521294,121.54067310000003,台北市中山區南京東路三段131號,2016-02-04 08:30~2016-02-04 09:15
第一次買法拍就上手：不點交、共有物、持分屋,Education,25.042403,121.512201,台北市中正區衡陽路51號7F之9,2016-02-05 11:00~2016-02-05 12:30
張芝華．ABH/PASH 國際催眠師雙證照．催眠體驗講座,Education,25.039393,121.57721300000004,台北市松德路18號4F 赫威思專業訓練中心,2016-02-02 11:15~2016-02-02 13:15
【愛線教室】肌力課-週四下午班,Sports,25.0392311,121.5439523,台北市大安區復興南路一段215號12樓,2016-02-04 07:30~2016-05-26 08:30
第七屆企業永續創業競賽－賽前研習營(台南場),Education,24.9873313,121.5761281,台北市文山區指南路二段64號,2016-02-01 16:00~2016-03-05 16:00
Test Test,Business,25.033334,121.5516119,台北市信義路,2016-02-01 01:30~2016-02-01 09:00
90 DAY TRAINING-綜合肌力訓練,Sports,25.047677,121.549351,台北市松山區敦化南路一段1號6樓B座,2016-05-04 01:00~2016-05-04 04:00
【 跨產業沙龍 N149】PIXNET 優像數位媒體科技顧問、璞成心遇空間總監、POWER FOR POINT 寶渥首席培訓師暨聯合創始人,Education,25.0417491,121.5276814,台北市中正區幸福里齊東街74號1樓,2016-11-30 11:00~2016-11-30 13:30
跑跑人_限量商品,Sports,25.073649,121.5450254,大佳河濱,2016-11-30 01:00~2016-11-30 09:00
女性科技創業交流暨募資活動,Technology,25.0782659,121.57522889999996,臺北市內湖科技園區服務中心2F國際會議廳(臺北市內湖區洲子街12號),2016-06-15 08:30~2016-06-15 11:30
【合約系列課程】代理vs.經銷合約訂定與履約,Education,25.0273353,121.51535749999994,青創總會(台北市中正區和平西路一段150號12樓),2016-04-13 01:30~2016-04-13 08:30
手作味噌說明會,Health,25.0487875,121.54223330000002,104台北市中山區遼寧街45巷36號,2016-04-16 05:30~2016-04-16 06:30
『福音，就是我的態度！』系列講座,Education,25.0593151,121.5629083,台北市松山區民生東路五段163-1號4樓,2016-04-17 02:00~2016-05-29 04:00
非洲舞原始脈動工作坊,Education,25.0513229,121.55765100000008,台北市松山區南京東路四段186號7樓之三,2016-04-16 01:30~2016-04-17 09:30
【3D動畫設計】- MAYA影視動畫,Education,25.0436519,121.51306899999996,台北市中正區重慶南路一段66號10樓,2016-04-12 01:30~2016-05-13 08:30
Live is life 第三場次【你的微小力量也能帶來巨大光芒】,Charity,25.0390103,121.52201330000004,臺北市中正區仁愛路一段17號,2016-04-15 11:00~2016-04-15 13:30
Landing in 1976 /// 20週年概念紀念展,Arts,25.0258011,121.52045220000002,台北市牯嶺街95巷51號,2016-04-16 05:00~2016-05-11 12:45
【魔法數字學】- 用數字打造 勝利人生,Education,25.0487212,121.5270769,台北市中山區長安東路一段61-1號,2016-04-12 11:00~2016-04-23 07:00
【拍照小殿堂】- 讓攝影自由,Photography,25.0524493,121.5139097,台北市大同區重慶北路一段82號2樓,2016-04-15 11:00~2016-04-15 13:00
手作乾燥小花束,Arts,25.0310447,121.51924699999996,悠福空間活動廳(台北市中正區羅斯福路一段32號),2016-04-16 06:00~2016-04-16 08:00
互聯網時代=邊旅遊+邊創業,Business,25.0659212,121.5178661,台北市昌吉街一號B1,2016-04-13 11:45~2016-04-13 14:00
[完全免費] 新創籌資新選擇! 股權性群眾募資!,Education,25.0267782,121.52238749999992,證券櫃買中心(台北市羅斯福路二段100號11樓),2016-04-15 06:00~2016-04-15 09:00
簡單投資 創造財富新選擇,Business,25.0310447,121.51924699999996,台北市羅斯福路一段32號9樓,2016-04-16 11:00~2016-04-16 13:00
【熟女專修】4/14 熟齡肌膚抗老學問大！,Health,25.043207725616533,121.56326419510653,台北市信義區忠孝東路四段553巷22弄6-1號,2016-04-14 06:00~2016-04-14 08:00
